<?xml version="1.0" encoding="UTF-8"?>
<xsd:schema	xmlns:xsd="http://www.w3.org/2001/XMLSchema" 
			targetNamespace="http://sanger.ac.uk/argml/xsd/property.xsd" 
			xmlns:p="http://sanger.ac.uk/argml/xsd/property.xsd"
			xmlns:xhtml="http://www.w3.org/1999/xhtml"
			xmlns="http://sanger.ac.uk/argml/xsd/property.xsd" >
	
	<xsd:import namespace="http://www.w3.org/1999/xhtml" schemaLocation="xhtml.xsd"/>

	<xsd:element name="environment">
		<xsd:complexType>
			<xsd:sequence>
				<xsd:element name="properties">
					<xsd:complexType>
						<xsd:choice maxOccurs="unbounded">
							<xsd:element name="string">
								<xsd:complexType>
									<xsd:complexContent>
										<xsd:extension base="property">
											<xsd:attribute name="default" type="xsd:string" />
										</xsd:extension>
									</xsd:complexContent>
								</xsd:complexType>
							</xsd:element>
							<xsd:element name="integer">
								<xsd:complexType>
									<xsd:complexContent>
										<xsd:extension base="property">
											<xsd:attribute name="default" type="xsd:int" />
										</xsd:extension>
									</xsd:complexContent>
								</xsd:complexType>
							</xsd:element>
							<xsd:element name="double">
								<xsd:complexType>
									<xsd:complexContent>
										<xsd:extension base="property">
											<xsd:attribute name="default" type="xsd:double" />
										</xsd:extension>
									</xsd:complexContent>
								</xsd:complexType>
							</xsd:element>
							<xsd:element name="boolean">
								<xsd:complexType>
									<xsd:complexContent>
										<xsd:extension base="property">
											<xsd:attribute name="default" type="xsd:boolean" />
										</xsd:extension>
									</xsd:complexContent>
								</xsd:complexType>
							</xsd:element>
						</xsd:choice>
					</xsd:complexType>
				</xsd:element>
				<xsd:element name="command">
					<xsd:complexType>
						<xsd:sequence>
							<xsd:element name="instruction" maxOccurs="unbounded">
								<xsd:complexType>
									<xsd:sequence>
										<xsd:element name="depend" type="dependency" maxOccurs="unbounded" minOccurs="0"/>
										<xsd:element name="input" type="xsd:string" minOccurs="0"/>
										<xsd:element name="output" type="xsd:string" minOccurs="0"/>
										<xsd:element name="help" type="xsd:string" minOccurs="0"/>
									</xsd:sequence>
									<xsd:attribute name="name" type="xsd:string" />
								</xsd:complexType>
								<xsd:unique name="unique-dependency">
									<xsd:selector xpath="./depend" />
									<xsd:field xpath="@name" />
								</xsd:unique>
							</xsd:element>
						</xsd:sequence>
						<xsd:attribute name="default" type="xsd:string" />
					</xsd:complexType>
				</xsd:element>			
			</xsd:sequence>
		</xsd:complexType>
		<xsd:unique name="unique-property">
			<xsd:selector xpath="./properties/*" />
			<xsd:field xpath="@name" />
		</xsd:unique>			
		<xsd:unique name="unique-property-symbol">
			<xsd:selector xpath="./properties/*" />
			<xsd:field xpath="@symbol" />
		</xsd:unique>			
		<xsd:unique name="unique-instruction">
			<xsd:selector xpath="./command/instruction" />
			<xsd:field xpath="@name" />
		</xsd:unique>
		<xsd:keyref name="instruction-dependecy" refer="unique-property">
			<xsd:selector xpath="./command/instruction/depend" />
			<xsd:field xpath="@name" />
		</xsd:keyref>			
	</xsd:element>
	
	<xsd:complexType name="dependency">
		<xsd:attribute name="name" type="xsd:string" use="required"/>
		<xsd:attribute name="optional" type="xsd:boolean"/>
	</xsd:complexType>
		
	<xsd:complexType name="property">
		<xsd:sequence>
			<xsd:element name="help" type="xsd:string" minOccurs="0"/>
		</xsd:sequence>
		<xsd:attribute name="name" type="xsd:string" use="required"/>
		<xsd:attribute name="symbol" type="xsd:string" use="required"/>
	</xsd:complexType>
	
</xsd:schema>